{
  "contract_version": "remediate-code-outcomes/v1alpha1",
  "total": 5,
  "by_outcome": {
    "resolved": 5,
    "verified_no_change": 0,
    "inappropriate": 0,
    "ignored": 0,
    "blocked": 0
  },
  "by_lens": {
    "reliability": {
      "resolved": 2
    },
    "maintainability": {
      "resolved": 1
    },
    "operability": {
      "resolved": 2
    }
  },
  "outcomes": [
    {
      "finding_id": "FINDING-001",
      "lens": "reliability",
      "file_exts": [
        ".ts"
      ],
      "outcome": "resolved",
      "rework_count": 0,
      "closing_status": "skipped"
    },
    {
      "finding_id": "FINDING-002",
      "lens": "maintainability",
      "file_exts": [
        ".ts"
      ],
      "outcome": "resolved",
      "rework_count": 0,
      "closing_status": "skipped"
    },
    {
      "finding_id": "FINDING-003",
      "lens": "operability",
      "file_exts": [
        ".ts"
      ],
      "outcome": "resolved",
      "rework_count": 0,
      "closing_status": "skipped"
    },
    {
      "finding_id": "FINDING-004",
      "lens": "operability",
      "file_exts": [
        ".ts"
      ],
      "outcome": "resolved",
      "rework_count": 0,
      "closing_status": "skipped"
    },
    {
      "finding_id": "FINDING-005",
      "lens": "reliability",
      "file_exts": [
        ".ts"
      ],
      "outcome": "resolved",
      "rework_count": 0,
      "closing_status": "skipped"
    }
  ]
}
